Id,Title,Release,PhotoUrl,Introduction
1,The Shining,1980-05-23,/images/The Shining.jpg,"A family heads to an isolated hotel for the winter where a sinister presence influences the father into violence."
2,The Shawshank Redemption,1994-09-23,/images/ShawshankRedemption.jpg,"Two imprisoned men bond over a number of years, finding solace and eventual redemption through acts of common decency."
3,The Truman Show,1998-06-05,/images/TheTrumanShow.jpg,"An insurance salesman discovers his entire life is actually a TV show."
4,Butterfly Effect,2004-01-23,/images/Bufferfly.jpg,"A young man finds he can travel back in time to change his past."
5,Inglourious Basterds,2009-08-21,/images/InglouriousBasterds.jpg,"A group of Jewish-American soldiers plan to assassinate Nazi leaders in occupied France."
6,Coherence,2013-06-20,/images/coherence.jpg,"On the night of an astronomical anomaly, eight friends gather for a dinner party, but strange occurrences disrupt the evening."